{
  "$schema": "https://json-schema.org/draft/2020-12/schema", "$id": "https://schemas.after-sale-flow.example/agent-platform/outcome/v1/outcome-compensation-receipt.schema.json", "title": "Outcome Compensation Receipt v1",
  "type": "object", "additionalProperties": false, "x-max-encoded-bytes": 32768,
  "required": ["schema_version", "workflow_id", "case_id", "receipt_id", "receipt_hash", "original_operation_id", "original_success_receipt_id", "original_success_receipt_hash", "compensation_operation_id", "compensation_receipt_id", "compensation_receipt_hash", "compensation_request_hash", "compensation_policy_version", "reverse_order", "status", "observed_at", "epoch", "source_revision", "revision", "fence", "committed_event_sequence"],
  "properties": {
    "schema_version": {"const": "outcome-compensation-receipt.v1"}, "workflow_id": {"$ref": "#/$defs/id"}, "case_id": {"$ref": "#/$defs/id"}, "receipt_id": {"$ref": "#/$defs/id"}, "receipt_hash": {"$ref": "#/$defs/hash"}, "original_operation_id": {"$ref": "#/$defs/id"}, "original_success_receipt_id": {"$ref": "#/$defs/id"}, "original_success_receipt_hash": {"$ref": "#/$defs/hash"}, "compensation_operation_id": {"$ref": "#/$defs/id"}, "compensation_receipt_id": {"$ref": "#/$defs/id"}, "compensation_receipt_hash": {"$ref": "#/$defs/hash"}, "compensation_request_hash": {"$ref": "#/$defs/hash"}, "compensation_policy_version": {"$ref": "#/$defs/id"}, "reverse_order": {"$ref": "#/$defs/count"}, "status": {"enum": ["SUCCEEDED", "FAILED"]}, "observed_at": {"$ref": "#/$defs/timestamp"},
    "epoch": {"$ref": "#/$defs/positive"}, "source_revision": {"$ref": "#/$defs/count"}, "revision": {"$ref": "#/$defs/count"}, "fence": {"$ref": "#/$defs/positive"}, "committed_event_sequence": {"$ref": "#/$defs/count"}
  },
  "$defs": {"id": {"type": "string", "minLength": 1, "maxLength": 128, "pattern": "^[A-Za-z0-9][A-Za-z0-9._:-]{0,127}$"}, "hash": {"type": "string", "pattern": "^[0-9a-f]{64}$"}, "count": {"type": "integer", "minimum": 0, "maximum": 9007199254740991}, "positive": {"type": "integer", "minimum": 1, "maximum": 9007199254740991}, "timestamp": {"type": "string", "format": "date-time"}}
}
